<?xml version="1.0"?>
<xs:schema xmlns:xs="http://www.w3.org/2001/XMLSchema">
  <xs:element name="users">
    <xs:complexType>
      <xs:sequence>
        <xs:element name="user" maxOccurs="unbounded">
          <xs:complexType>
            <xs:sequence>
              <xs:element name="id" type="xs:int"/>
              <xs:element name="name">
                <xs:complexType>
                  <xs:sequence>
                    <xs:element name="first" type="xs:string"/>
                    <xs:element name="last" type="xs:string"/>
                  </xs:sequence>
                </xs:complexType>
              </xs:element>
              <xs:element name="birthdate" type="xs:date" minOccurs="0"/>
              <xs:element name="hiredate" type="xs:date" />
              <xs:element name="role" type="xs:string"  maxOccurs="unbounded"/>
              <xs:element name="userType" type="xs:string"/>
              <xs:element name="credentials">
                <xs:complexType>
                  <xs:sequence>
                    <xs:element name="email" type="xs:string"/>
                    <xs:element name="password" type="xs:string"/>
                  </xs:sequence>
                </xs:complexType>
              </xs:element>
            </xs:sequence>
          </xs:complexType>
        </xs:element>
      </xs:sequence>
    </xs:complexType>  
  </xs:element>
</xs:schema>